title,url,summary,category,source_type,location,event_date,tags,people,priority,notes
3 Wellness Retreats for Web3 Creators This Month,https://luma.example/everyday-web3-retreats,"A curated set of retreats for creators, founders, and community leads dealing with burnout after conference season.",Health and Wellness,event,Lisbon,2026-06-20,"creator wellness,retreat,meditation,burnout",,5,Evening shift feature
Underrated Local DAO Meetups in Miami,https://plan.example/miami-dao-meetups,"Small local DAO meetups are becoming useful spaces for builders to reconnect, share jobs, and rebuild trust offline.",Lifestyle & Events,meetup,Miami,2026-06-18,"local dao,community rebuild,meetup",,5,Good Telegram and Discord local alpha
How a Creator Uses Meditation to Handle Volatility,https://x.com/example/status/0001,"A creator shared a practical meditation routine for staying grounded through market swings and launch pressure.",Health and Wellness,post,Remote,,"creator wellness,meditation,volatility",Ava Builder,4,Creator spotlight format
Web3 Coffee Meetup Adds Stablecoin Checkout Demo,https://x.com/example/status/0002,"A cafe meetup included a live stablecoin checkout demo for creators and local merchants.",Food & Drinks,event,Berlin,2026-06-14,"food,stablecoin,payment,merchant",,4,Commerce side of everyday web3
Conference City Guide for Crypto Nomads,https://cryptonomads.example/city-guide,"A new guide maps crypto-friendly coworking spaces, hotels, gyms, and community events around a major conference week.",Travel,article,Dubai,2026-06-25,"travel,nomad,coworking,conference city",,3,Useful for Pinterest board expansion
Hackathon Team Ships Mobile Wallet for Event Perks,https://x.com/example/status/0003,"A hackathon project turns event attendance, perks, and partner offers into a simple mobile wallet experience.",Hackathons,post,Online,,"hackathon,mobile,wallet,events",,3,Morning recap item
Luxury Gallery Tests Token-Gated Collector Night,https://x.com/example/status/0004,"A gallery used token-gated access for a collector night that mixed physical art, luxury retail, and digital memberships.",Art & Luxury,event,Paris,2026-07-02,"art,luxury,collectibles,membership",,3,Good X thread or blog outline
Crypto Tax Clinic for Freelancers,https://luma.example/crypto-tax-clinic,"A practical clinic helps freelancers understand tax records, income tracking, and compliance after being paid onchain.",Taxes,event,London,2026-06-28,"tax,freelancer,compliance,onchain income",,2,Less sexy but very everyday web3
